{
  "version": "v0.1",
  "runtime_plane_mode": "result_normalization",
  "line_class": "mandatory_core_absorption_line",
  "output_class": "machine_safe",
  "status": "ok",
  "errors": [],
  "warnings": [],
  "artifact_refs": ["result.json"],
  "normalized_payload_class": "structured_result",
  "prose_only_result_allowed": false
}
